Название,Состав,Цена,Ссылка на товар
НАСЛАЖДЕНИЕ,"Состав: копченая курица, перец, лист салата, томаты черри, огурец, чесночный соус","6,10 BYN",https://sushidom.by/product/naslazhdenie/
САШИМИ ИЗ ЛОСОСЯ,"Состав: лосось фунчоза, дайкон, имбирь, васаби, лимон, соевый соус","8,00 BYN",https://sushidom.by/product/sashimi-iz-lososja/
ТАРТАР ИЗ ЛОСОСЯ,"Состав: лосось, манго, лук, укроп, горчица, сметана, икра лососевая, крутоны, лимон","13,90 BYN",https://sushidom.by/product/tartar-iz-lososja/
УНАГИ САРАДА,"Состав: Томаты черри, лист салата, угорь, авокадо, кунжут, ореховый соус","8,30 BYN",https://sushidom.by/product/unagi-sarada/
ФИЛАДЕЛЬФИЯ,"Состав: огурец, рис, майонез, икра Тобико, форель, соус спайси, водоросли нори","8,50 BYN",https://sushidom.by/product/filadelfija/
ХОККАЙДО САРАДА,"Состав: фунчоза, грибы шиитаке, дайкон, перец, лук порей, японская заправка","4,90 BYN",https://sushidom.by/product/hokkajdo-sarada/
ЦЕЗАРЬ С КРЕВЕТКАМИ,"Состав: лист салата, томаты черри, креветки, пармезан, крутоны, соус Цезарь","7,10 BYN",https://sushidom.by/product/cezar-s-krevetkami/
ЦЕЗАРЬ С КУРИЦЕЙ,"Состав: лист салата, томаты черри, курица, пармезан, крутоны, соус Цезарь","5,80 BYN",https://sushidom.by/product/cezar-s-kuricej/
ЧУКА САРАДА,"Состав: чукка, тунец, лосось, томаты черри, ореховый соус","8,70 BYN",https://sushidom.by/product/chuka-sarada/
